{
  "$schema": "http://json-schema.org/draft-07/schema#",
  "title": "Joan Garcia",
  "description": "Schema for joangarcia.dev i18n translation files.",
  "type": "object",
  "properties": {
    "seo": {
      "type": "object",
      "properties": {
        "home": {
          "type": "object",
          "properties": {
            "title": {
              "type": "string"
            }
          }
        }
      }
    },
    "nav": {
      "type": "object",
      "properties": {
        "projects": { "type": "string" },
        "readme": { "type": "string" },
        "blog": { "type": "string" },
        "linkedin": { "type": "string" },
        "github": { "type": "string" },
        "gmail": { "type": "string" },
        "theme_dark": { "type": "string" },
        "theme_light": { "type": "string" },
        "lang_english": { "type": "string" },
        "lang_spanish": { "type": "string" }
      },
      "additionalProperties": false
    },
    "footer": {
      "type": "object",
      "properties": {
        "logo": { "type": "string" },
        "copyright": { "type": "string" },
        "col_pages": { "type": "string" },
        "col_connect": { "type": "string" },
        "col_built_with": { "type": "string" },
        "link_github": { "type": "string" },
        "link_linkedin": { "type": "string" },
        "link_gmail": { "type": "string" }
      },
      "additionalProperties": false
    },
    "error": {
      "type": "object",
      "properties": {
        "401": {
          "type": "string"
        },
        "404": {
          "type": "string"
        },
        "500": {
          "type": "string"
        },
        "503": {
          "type": "string"
        },
        "default": {
          "type": "string"
        }
      },
      "additionalProperties": false
    },
    "common": {
      "type": "object",
      "properties": {
        "go_back_home": {
          "type": "string"
        },
        "software_engineer": {
          "type": "string"
        },
        "switch_to_english": {
          "type": "string"
        },
        "switch_to_spanish": {
          "type": "string"
        }
      },
      "additionalProperties": false
    },
    "hero": {
      "type": "object",
      "properties": {
        "title": {
          "type": "string"
        },
        "subtitle": {
          "type": "string"
        },
        "subtitle2": {
          "type": "string"
        },
        "current_work": {
          "type": "string"
        },
        "cta": {
          "type": "string"
        }
      },
      "additionalProperties": false
    },
    "stack": {
      "type": "object",
      "properties": {
        "title": {
          "type": "string"
        }
      },
      "additionalProperties": false
    },
    "projects": {
      "type": "object",
      "properties": {
        "search_placeholder": {
          "type": "string"
        },
        "repo_count": {
          "type": "string"
        },
        "view_on_github": {
          "type": "string"
        },
        "no_results": {
          "type": "string"
        }
      },
      "additionalProperties": false
    },
    "readme": {
      "type": "object",
      "properties": {
        "last_updated": { "type": "string" },
        "title": { "type": "string" },
        "description": { "type": "string" },
        "about_title": { "type": "string" },
        "about_p1": { "type": "string" },
        "about_p2": { "type": "string" },
        "quickstart_title": { "type": "string" },
        "stack_title": { "type": "string" },
        "stack_nuxt": { "type": "string" },
        "stack_unocss": { "type": "string" },
        "stack_i18n": { "type": "string" },
        "stack_darkmode": { "type": "string" },
        "stack_typescript": { "type": "string" },
        "stack_font": { "type": "string" },
        "features_title": { "type": "string" },
        "feature_1": { "type": "string" },
        "feature_2": { "type": "string" },
        "feature_3": { "type": "string" },
        "feature_4": { "type": "string" },
        "structure_title": { "type": "string" },
        "inspirations_title": { "type": "string" },
        "inspirations_desc": { "type": "string" },
        "insp_nav": { "type": "string" },
        "insp_projects": { "type": "string" },
        "insp_menu": { "type": "string" },
        "insp_design": { "type": "string" },
        "license_title": { "type": "string" },
        "license_text": { "type": "string" },
        "star_repo": { "type": "string" }
      },
      "additionalProperties": false
    },
    "blog": {
      "type": "object",
      "properties": {
        "seo_title": { "type": "string" },
        "title": { "type": "string" },
        "subtitle": { "type": "string" },
        "coming_soon_title": { "type": "string" },
        "coming_soon_description": { "type": "string" }
      },
      "additionalProperties": false
    }
  }
}
